{
  "id": "topic:crypto-poker",
  "type": "topic",
  "name": "Crypto poker",
  "slug": "crypto-poker",
  "aliases": ["Bitcoin poker"],
  "summary": "Editorial topic covering poker products, payments, and audiences connected to cryptocurrency.",
  "status": "active",
  "attributes": {
    "article_type_fit": ["guide", "comparison", "review"]
  },
  "source_ids": [],
  "updated_at": "2026-07-04T00:00:00Z"
}
